{
  "$schema": "https://json-schema.org/draft/2020-12/schema",
  "$id": "https://atlas-plugin/schema/backlog.schema.json",
  "title": "Atlas Backlog",
  "description": "Data contract for a project backlog consumed by the Atlas Plugin",
  "type": "object",
  "required": ["generated_at", "tasks"],
  "additionalProperties": true,
  "properties": {
    "generated_at": {
      "type": "string",
      "format": "date-time"
    },
    "task_count": {
      "type": "integer"
    },
    "module_count": {
      "type": "integer"
    },
    "source_prd": {
      "type": "string"
    },
    "source_decomposition": {
      "type": "string"
    },
    "updated_at": {
      "type": "string"
    },
    "modules": {
      "type": "array",
      "description": "Registry of module names referenced by stories[].module and tasks[].module. Every distinct value used in stories[].module or tasks[].module SHOULD appear here as a `name` (referential integrity is enforced by the compliance workflow on backlog-change PRs, not by JSON Schema alone — pure JSON Schema can't cross-reference arrays). When introducing a new module name via /atlas-update, add it to this registry in the same PR.",
      "items": {
        "type": "object",
        "required": ["id", "name"],
        "additionalProperties": true,
        "properties": {
          "id": { "type": "string", "description": "Stable module identifier (e.g. M1, M2). Reused across renames." },
          "name": { "type": "string", "description": "Human-readable module name shown in PhaseCards, drill-down, and chip labels. This is what stories[].module references." },
          "phase_raw": { "type": "string" }
        }
      }
    },
    "stories": {
      "type": "array",
      "items": {
        "type": "object",
        "required": ["id", "title", "module", "phase"],
        "additionalProperties": true,
        "properties": {
          "id": { "type": "string" },
          "title": { "type": "string" },
          "description": { "type": "string" },
          "module": { "type": "string" },
          "phase": { "type": "integer", "minimum": 1 },
          "acceptance": {
            "type": "array",
            "items": { "type": "string" }
          },
          "labels": { "type": "array", "items": { "type": "string" } },
          "priority": { "type": "string" },
          "status": {
            "type": "string",
            "enum": ["pending", "in_progress", "merged", "blocked", "deferred"]
          },
          "state": {
            "type": "string",
            "enum": ["queued","claimed","working","pr_open","in_review","ci_running","ci_passed","ci_failed","merged","verified","blocked"]
          },
          "claim_id":   { "oneOf": [{ "type": "string" }, { "type": "null" }] },
          "claimed_by": { "oneOf": [{ "type": "string" }, { "type": "null" }] },
          "pr_number":  { "oneOf": [{ "type": "integer" }, { "type": "null" }] },
          "pr_url":     { "oneOf": [{ "type": "string" }, { "type": "null" }] },
          "merged_at":  { "oneOf": [{ "type": "string" }, { "type": "null" }] },
          "events":     { "type": "array", "items": { "type": "object", "additionalProperties": true } },
          "kb_articles": {
            "type": "array",
            "description": "Slugs of KB articles supporting this story. Bidirectional with kb/_index.json#/articles[].related_stories.",
            "items": { "type": "string" }
          },
          "estimate_ai_hours": {
            "type": "number",
            "minimum": 0,
            "description": "Estimated hours of AI-agent time required to complete this story end-to-end (claim → merge). Set on add / prd-intake / refine. Used by Telemetry to plot estimate-vs-actual + roll up phase-level burn-down. Reconciler captures the actual via merged_at - first_event_at and surfaces the delta in DrillDownPanel. v1.8.1+."
          },
          "actual_ai_hours": {
            "type": "number",
            "minimum": 0,
            "description": "Reconciler-populated actual AI-hours from claim → merge. Read-only via /atlas-update; the reconciler is the only writer. v1.8.1+."
          },
          "supersedes": {
            "type": "string",
            "description": "ID of the story this one replaces. When set, the predecessor's `superseded_by` should include this story."
          },
          "superseded_by": {
            "type": "array",
            "description": "IDs of stories that replace this one (used for splits and rewrites). When non-empty, this story is retired — reconciler ignores it for PR matching + KPI math.",
            "items": { "type": "string" }
          },
          "merges_from": {
            "type": "array",
            "description": "IDs of stories that were merged INTO this one. The listed predecessors should be marked superseded_by: [<this id>].",
            "items": { "type": "string" }
          },
          "deferred_reason": {
            "type": "string",
            "description": "Why this story was deferred. Required when state === 'deferred'. Free text — shown in the drill-down."
          },
          "depends_on": {
            "type": "array",
            "description": "IDs of stories/tasks that must reach state merged or verified before this story may be claimed.",
            "items": { "type": "string" }
          },
          "ui": { "type": "boolean", "description": "True if this is a visual/UI change; routes the story to in_review for human QA sign-off and blocks verified until signed off." },
          "worktree_branch": { "oneOf": [{ "type": "string" }, { "type": "null" }], "description": "The feat/<id>-… branch this story is claimed on, or null." },
          "evolution_log": {
            "type": "array",
            "description": "Append-only audit trail of /atlas-update operations on this story. Each entry captures who, when, why, and what changed. Surfaced in the DrillDownPanel + Activity feed + Changes page so Delivery Managers can audit plan changes.",
            "items": {
              "type": "object",
              "required": ["timestamp", "operation", "reason"],
              "additionalProperties": true,
              "properties": {
                "timestamp": { "type": "string", "description": "ISO-8601 of when the change was applied (PR merge time)." },
                "operation": {
                  "type": "string",
                  "enum": ["refine", "add", "split", "merge", "defer", "undefer", "prd-intake", "phase-create", "phase-update"],
                  "description": "Which /atlas-update operation produced this entry. prd-intake = a story landed as part of a bulk PRD ingest (the same reason text typically appears on every story in the batch). phase-create / phase-update = the entry was written because a brand-new phase was added (or its metadata changed) in atlas.config.json under the same PR; the story field deltas live in `changes` but the structural shift is at phase-overlay level."
                },
                "by": { "type": "string", "description": "GitHub login of the dev/agent that opened the backlog-change PR." },
                "reason": { "type": "string", "description": "Required justification — why this change is being made. DM-visible." },
                "changes": {
                  "type": "object",
                  "description": "Optional structured diff. Free-form per-field — e.g. { acceptance: '3 items → 4 items', phase: '3 → 4' }.",
                  "additionalProperties": true
                },
                "pr_url": { "type": "string", "description": "URL of the atlas:backlog-change PR that introduced the change." },
                "pr_number": { "type": "integer" }
              }
            }
          }
        }
      }
    },
    "tasks": {
      "type": "array",
      "items": {
        "type": "object",
        "required": ["id", "title", "module", "phase", "status"],
        "additionalProperties": true,
        "properties": {
          "id": { "type": "string" },
          "story_id": {
            "type": "string",
            "description": "Parent story ID (links into stories[].id). Required when stories[] is present."
          },
          "title": { "type": "string" },
          "module": { "type": "string" },
          "phase": {
            "type": "integer",
            "minimum": 1
          },
          "status": {
            "type": "string",
            "enum": ["pending", "in_progress", "merged", "blocked", "deferred"]
          },
          "state": {
            "type": "string",
            "enum": ["queued","claimed","working","pr_open","in_review","ci_running","ci_passed","ci_failed","merged","verified","blocked"]
          },
          "events": {
            "type": "array",
            "items": {
              "type": "object",
              "additionalProperties": true
            }
          },
          "tier": { "type": "string" },
          "effort": { "type": "string" },
          "estimate": { "type": "string" },
          "depends_on": {
            "type": "array",
            "items": { "type": "string" }
          },
          "what": { "type": "string" },
          "where": { "type": "string" },
          "acceptance": { "type": "string" },
          "risk": { "type": "string" },
          "pr_url": { "type": "string" },
          "pr_number": {
            "oneOf": [
              { "type": "integer" },
              { "type": "null" }
            ]
          },
          "merged_at": {
            "oneOf": [
              { "type": "string" },
              { "type": "null" }
            ]
          },
          "claimed_by": {
            "oneOf": [
              { "type": "string" },
              { "type": "null" }
            ]
          },
          "worktree_branch": {
            "oneOf": [
              { "type": "string" },
              { "type": "null" }
            ]
          },
          "ui": { "type": "boolean", "description": "True if this is a visual/UI change requiring human QA sign-off." },
          "guardrails": {
            "type": "object"
          },
          "prd_anchor": {
            "type": "string"
          },
          "blocker": {
            "description": "Orthogonal flag — task is blocked by an external factor or human decision, INDEPENDENT of its lifecycle state. A claimed task can be blockered (waiting on legal review), a pr_open task can be blockered (waiting on a vendor), etc. Cleared by setting to null. v1.8.2+.",
            "oneOf": [
              { "type": "null" },
              {
                "type": "object",
                "required": ["reason", "since"],
                "additionalProperties": true,
                "properties": {
                  "reason": { "type": "string", "description": "Human-readable reason — what is blocking, and what would unblock it." },
                  "since": { "type": "string", "description": "ISO-8601 timestamp of when the blocker was set." },
                  "by": { "type": "string", "description": "GitHub login of who flagged the blocker." }
                }
              }
            ]
          },
          "needs_human_review": {
            "description": "Orthogonal flag — AI implementer believes the work is complete but a specific human's eyes are required before merge. Layers on top of lifecycle state. Cleared by setting to null. v1.8.2+.",
            "oneOf": [
              { "type": "null" },
              {
                "type": "object",
                "required": ["since"],
                "additionalProperties": true,
                "properties": {
                  "reviewer": { "type": "string", "description": "GitHub login of the requested reviewer (optional — falls back to any human reviewer on the PR)." },
                  "context": { "type": "string", "description": "Why human review is needed for THIS task. E.g. 'AI auto-merged a similar pattern incorrectly last week; please verify the rate-limit math'." },
                  "since": { "type": "string", "description": "ISO-8601 timestamp of when human review was requested." },
                  "by": { "type": "string", "description": "GitHub login of who requested review." }
                }
              }
            ]
          }
        }
      }
    }
  }
}
