{
  "generated_at": "2026-05-31T18:15:34.876Z",
  "task_count": 3,
  "modules": [
    {
      "id": "M1",
      "name": "Frontend",
      "phase_raw": "Phase 1"
    }
  ],
  "stories": [
    {
      "id": "S1",
      "title": "Scaffold the Vite + React app (Todos + About)",
      "module": "M1",
      "phase": 1,
      "status": "merged",
      "state": "merged",
      "acceptance": [
        "`npm run build` succeeds",
        "Two pages exist: Todos and About",
        "Nav links switch between the two pages"
      ],
      "depends_on": [],
      "ui": true,
      "pr_number": 2,
      "merged_at": "2026-05-30T04:41:04Z",
      "pr_url": "https://github.com/ShingShen2003/atlas-devloop-demo/pull/2",
      "claimed_by": "ShingShen2003",
      "actual_ai_hours": 0.04
    },
    {
      "id": "S2",
      "title": "Priority badges on todo items",
      "module": "M1",
      "phase": 1,
      "status": "merged",
      "state": "merged",
      "acceptance": [
        "Each todo shows a colored priority badge (high/medium/low)",
        "The badge is visible on the Home (Todos) page"
      ],
      "depends_on": [
        "S1"
      ],
      "ui": true,
      "pr_number": 3,
      "merged_at": "2026-05-30T04:55:59Z",
      "pr_url": "https://github.com/ShingShen2003/atlas-devloop-demo/pull/3",
      "claimed_by": "ShingShen2003",
      "actual_ai_hours": 0.1
    },
    {
      "id": "S3",
      "title": "Footer with app version",
      "module": "M1",
      "phase": 1,
      "status": "pending",
      "state": "queued",
      "acceptance": [
        "A footer shows the app version on every page"
      ],
      "depends_on": [
        "S2"
      ],
      "ui": true
    }
  ],
  "tasks": [
    {
      "id": "T1",
      "story_id": "S1",
      "title": "Scaffold Vite + React app",
      "module": "M1",
      "phase": 1,
      "status": "merged",
      "state": "merged",
      "pr_number": 2,
      "merged_at": "2026-05-30T04:41:04Z",
      "pr_url": "https://github.com/ShingShen2003/atlas-devloop-demo/pull/2",
      "claimed_by": "ShingShen2003"
    },
    {
      "id": "T2",
      "story_id": "S2",
      "title": "Add priority field + Badge component",
      "module": "M1",
      "phase": 1,
      "status": "merged",
      "state": "merged",
      "depends_on": [
        "S1"
      ],
      "pr_number": 3,
      "merged_at": "2026-05-30T04:55:59Z",
      "pr_url": "https://github.com/ShingShen2003/atlas-devloop-demo/pull/3",
      "claimed_by": "ShingShen2003"
    },
    {
      "id": "T3",
      "story_id": "S3",
      "title": "Add Footer component with version",
      "module": "M1",
      "phase": 1,
      "status": "pending",
      "state": "queued",
      "depends_on": [
        "S2"
      ]
    }
  ]
}
